{
  "schema": "context-query-variants.v1",
  "query_count": 60,
  "source_manifest_fingerprint": "sha256:b5c444a083782bdf21f28fe2919a7655a570b363147c489d3a068c0bbd3411bf",
  "canonical_fingerprint": "sha256:25ed830fb2d253c60a3c59f372506687b76af1ec34298060202b677a20cb7b4a",
  "queries": [
    {"schema":"context-query-variant.v1","query_id":"CTX-01.V01","parent_task_id":"CTX-01","variant_index":1,"question":"For the MCP decision-envelope review concern, identify the accepted governing decision, why review precedes mutation, and the governing Constitution principle.","fixture":"real-current","resolver_hints":{"adr_ids":["adr_mcp_decision_envelope_review"],"decision_refs":[],"topics":["mcp-tools","schema"],"paths":[]}},
    {"schema":"context-query-variant.v1","query_id":"CTX-01.V02","parent_task_id":"CTX-01","variant_index":2,"question":"What accepted decision governs MCP decision-envelope review, and which Constitution principle requires review before a mutation?","fixture":"real-current","resolver_hints":{"adr_ids":["adr_mcp_decision_envelope_review"],"decision_refs":[],"topics":["mcp-tools","schema"],"paths":[]}},
    {"schema":"context-query-variant.v1","query_id":"CTX-01.V03","parent_task_id":"CTX-01","variant_index":3,"question":"Trace the accepted authority for the MCP decision-envelope review concern: explain the review-before-mutation rule and cite its Constitution basis.","fixture":"real-current","resolver_hints":{"adr_ids":["adr_mcp_decision_envelope_review"],"decision_refs":[],"topics":["mcp-tools","schema"],"paths":[]}},
    {"schema":"context-query-variant.v1","query_id":"CTX-01.V04","parent_task_id":"CTX-01","variant_index":4,"question":"Which accepted MCP review decision controls this concern? State why mutation follows review and name the applicable Constitution principle.","fixture":"real-current","resolver_hints":{"adr_ids":["adr_mcp_decision_envelope_review"],"decision_refs":[],"topics":["mcp-tools","schema"],"paths":[]}},
    {"schema":"context-query-variant.v1","query_id":"CTX-01.V05","parent_task_id":"CTX-01","variant_index":5,"question":"Explain the governing accepted decision for MCP decision-envelope review, including the reason review is required before mutation and its Constitution principle.","fixture":"real-current","resolver_hints":{"adr_ids":["adr_mcp_decision_envelope_review"],"decision_refs":[],"topics":["mcp-tools","schema"],"paths":[]}},
    {"schema":"context-query-variant.v1","query_id":"CTX-02.V01","parent_task_id":"CTX-02","variant_index":1,"question":"Explain how MCP decision-envelope review evolved from its partitioned-authority origin to the accepted head, preserving typed lineage and the Constitution distinction.","fixture":"real-current","resolver_hints":{"adr_ids":["adr_mcp_decision_envelope_review"],"decision_refs":["mse_17d0qqh34a07qp5b:d1"],"topics":["mcp-tools","schema"],"paths":[]}},
    {"schema":"context-query-variant.v1","query_id":"CTX-02.V02","parent_task_id":"CTX-02","variant_index":2,"question":"Show the typed evolution from the original MCP partitioned-authority decision to the accepted head, and cite the Constitution rule separating head from predecessor.","fixture":"real-current","resolver_hints":{"adr_ids":["adr_mcp_decision_envelope_review"],"decision_refs":["mse_17d0qqh34a07qp5b:d1"],"topics":["mcp-tools","schema"],"paths":[]}},
    {"schema":"context-query-variant.v1","query_id":"CTX-02.V03","parent_task_id":"CTX-02","variant_index":3,"question":"For MCP decision-envelope review, narrate the accepted evolution from partitioned authority while retaining edge types and the governing Constitution distinction.","fixture":"real-current","resolver_hints":{"adr_ids":["adr_mcp_decision_envelope_review"],"decision_refs":["mse_17d0qqh34a07qp5b:d1"],"topics":["mcp-tools","schema"],"paths":[]}},
    {"schema":"context-query-variant.v1","query_id":"CTX-02.V04","parent_task_id":"CTX-02","variant_index":4,"question":"Which lineage leads from the original partitioned-authority MCP decision to the accepted head, and what Constitution rule explains their different roles?","fixture":"real-current","resolver_hints":{"adr_ids":["adr_mcp_decision_envelope_review"],"decision_refs":["mse_17d0qqh34a07qp5b:d1"],"topics":["mcp-tools","schema"],"paths":[]}},
    {"schema":"context-query-variant.v1","query_id":"CTX-02.V05","parent_task_id":"CTX-02","variant_index":5,"question":"Preserve typed lineage while explaining the MCP review concern's path from partitioned authority to its accepted head and the relevant Constitution rule.","fixture":"real-current","resolver_hints":{"adr_ids":["adr_mcp_decision_envelope_review"],"decision_refs":["mse_17d0qqh34a07qp5b:d1"],"topics":["mcp-tools","schema"],"paths":[]}},
    {"schema":"context-query-variant.v1","query_id":"CTX-03.V01","parent_task_id":"CTX-03","variant_index":1,"question":"For the parent-first sidecar transaction concern, identify the accepted decision, its rationale, and the Constitution constraint protected by the ordering.","fixture":"real-current","resolver_hints":{"adr_ids":["adr_parent_first_sidecar_transaction"],"decision_refs":[],"topics":["session-fuse","feature-build"],"paths":[]}},
    {"schema":"context-query-variant.v1","query_id":"CTX-03.V02","parent_task_id":"CTX-03","variant_index":2,"question":"What accepted decision governs parent-first sidecar transactions, why is that order used, and which Constitution constraint does it protect?","fixture":"real-current","resolver_hints":{"adr_ids":["adr_parent_first_sidecar_transaction"],"decision_refs":[],"topics":["session-fuse","feature-build"],"paths":[]}},
    {"schema":"context-query-variant.v1","query_id":"CTX-03.V03","parent_task_id":"CTX-03","variant_index":3,"question":"Identify the accepted authority for parent-first sidecar transactions and explain the recoverability rationale with its Constitution constraint.","fixture":"real-current","resolver_hints":{"adr_ids":["adr_parent_first_sidecar_transaction"],"decision_refs":[],"topics":["session-fuse","feature-build"],"paths":[]}},
    {"schema":"context-query-variant.v1","query_id":"CTX-03.V04","parent_task_id":"CTX-03","variant_index":4,"question":"Which accepted parent-first sidecar decision applies here? Give its rationale and the Constitution rule the transaction order safeguards.","fixture":"real-current","resolver_hints":{"adr_ids":["adr_parent_first_sidecar_transaction"],"decision_refs":[],"topics":["session-fuse","feature-build"],"paths":[]}},
    {"schema":"context-query-variant.v1","query_id":"CTX-03.V05","parent_task_id":"CTX-03","variant_index":5,"question":"Explain the governing accepted decision and ordering constraint for a parent-first recoverable sidecar transaction.","fixture":"real-current","resolver_hints":{"adr_ids":["adr_parent_first_sidecar_transaction"],"decision_refs":[],"topics":["session-fuse","feature-build"],"paths":[]}},
    {"schema":"context-query-variant.v1","query_id":"CTX-04.V01","parent_task_id":"CTX-04","variant_index":1,"question":"Explain the accepted evolution of the parent-first recoverable sidecar transaction, retaining lifecycle-edge types and how revisions preserve recoverability.","fixture":"real-current","resolver_hints":{"adr_ids":["adr_parent_first_sidecar_transaction"],"decision_refs":["mse_17d0qqh34a07qp5b:d2"],"topics":["session-fuse"],"paths":[]}},
    {"schema":"context-query-variant.v1","query_id":"CTX-04.V02","parent_task_id":"CTX-04","variant_index":2,"question":"Trace the accepted parent-first sidecar transaction through its typed lifecycle and explain how each revision keeps the recoverability constraint intact.","fixture":"real-current","resolver_hints":{"adr_ids":["adr_parent_first_sidecar_transaction"],"decision_refs":["mse_17d0qqh34a07qp5b:d2"],"topics":["session-fuse"],"paths":[]}},
    {"schema":"context-query-variant.v1","query_id":"CTX-04.V03","parent_task_id":"CTX-04","variant_index":3,"question":"What is the accepted evolution of the parent-first recoverable sidecar transaction? Preserve edge types and the recoverability reasoning.","fixture":"real-current","resolver_hints":{"adr_ids":["adr_parent_first_sidecar_transaction"],"decision_refs":["mse_17d0qqh34a07qp5b:d2"],"topics":["session-fuse"],"paths":[]}},
    {"schema":"context-query-variant.v1","query_id":"CTX-04.V04","parent_task_id":"CTX-04","variant_index":4,"question":"Describe each typed revision in the accepted parent-first sidecar lineage and why the sequence remains recoverable.","fixture":"real-current","resolver_hints":{"adr_ids":["adr_parent_first_sidecar_transaction"],"decision_refs":["mse_17d0qqh34a07qp5b:d2"],"topics":["session-fuse"],"paths":[]}},
    {"schema":"context-query-variant.v1","query_id":"CTX-04.V05","parent_task_id":"CTX-04","variant_index":5,"question":"Follow the parent-first sidecar transaction to its accepted form, preserving lifecycle types and explaining the protected recoverability constraint.","fixture":"real-current","resolver_hints":{"adr_ids":["adr_parent_first_sidecar_transaction"],"decision_refs":["mse_17d0qqh34a07qp5b:d2"],"topics":["session-fuse"],"paths":[]}},
    {"schema":"context-query-variant.v1","query_id":"CTX-05.V01","parent_task_id":"CTX-05","variant_index":1,"question":"For the session-decision authority concern, identify the accepted governing decision, the boundary between session evidence and ADR synopsis, and the relevant Constitution section.","fixture":"real-current","resolver_hints":{"adr_ids":["adr_session_decision_authority"],"decision_refs":[],"topics":["schema"],"paths":[]}},
    {"schema":"context-query-variant.v1","query_id":"CTX-05.V02","parent_task_id":"CTX-05","variant_index":2,"question":"What accepted decision defines session-decision authority, and how does it distinguish session evidence from an ADR synopsis under the Constitution?","fixture":"real-current","resolver_hints":{"adr_ids":["adr_session_decision_authority"],"decision_refs":[],"topics":["schema"],"paths":[]}},